{
 "schema_version": 1,
 "reverbscope_version": "0.5.0b2",
 "created_at": "2026-10-07T05:31:51+00:00",
 "sample_rate": 48000,
 "sweep_settings": {
  "sample_rate": 48000,
  "duration_s": 0.5,
  "start_hz": 20.0,
  "end_hz": 20000.0,
  "fade_in_s": 0.05,
  "fade_out_s": 0.01,
  "level_dbfs": -12.0,
  "pre_silence_s": 1.0,
  "post_silence_s": 1.5
 },
 "analysis_settings": {
  "channel": null,
  "ir_pre_delay_ms": 5.0,
  "ir_max_length_s": 0.2,
  "octave_bands_hz": [
   63.0,
   125.0,
   250.0,
   500.0,
   1000.0,
   2000.0,
   4000.0,
   8000.0
  ],
  "fr_window_s": null,
  "fr_smoothing_fraction": 6,
  "noise_min_segment_s": 0.5,
  "reflections_min_delay_ms": 0.8,
  "reflections_max_delay_ms": 80.0,
  "reflections_threshold_db": -20.0,
  "reflections_prominence_db": 6.0,
  "resonance_max_hz": 300.0,
  "resonance_min_prominence_db": 6.0,
  "decay_noise_margin_db": 10.0,
  "placement_distance_m": null,
  "placement_mic_height_m": null,
  "placement_temperature_c": null,
  "loopback_channel": null,
  "calibration": null,
  "channel_analysed": 0
 },
 "impulse_response": {
  "sample_rate": 48000,
  "length_samples": 9841,
  "direct_sound_index": 240,
  "direct_sound_time_s": 0.005,
  "pre_delay_samples": 240,
  "peak_value": 0.7634344020881492,
  "direct_level_dbfs": -11.973631050249745,
  "valid_length_s": 1.7999791666666667,
  "pre_peak_margin_db": 55.545825813143125,
  "direct_sound_confidence": "high",
  "sweep_start_in_recording_s": 1.0,
  "first_sweep_start_in_recording_s": 1.0,
  "sweep_passes": 1,
  "excitation_band": {
   "low_hz": 39.905246299377595,
   "high_hz": 17419.271799121612,
   "source": "sweep settings",
   "note": null
  },
  "harmonic_distortion": [
   {
    "order": 2,
    "offset_s": 0.050171665943996864,
    "level_db": null,
    "floor_db": -47.14296066782393,
    "band_hz": [
     159.62098519751038,
     8709.635899560806
    ],
    "reason": "not distinguishable from the floor (at most -60.4 dB, floor -47.1 dB)"
   },
   {
    "order": 3,
    "offset_s": 0.07952020911994374,
    "level_db": null,
    "floor_db": -52.45925146229759,
    "band_hz": [
     239.43147779626557,
     8709.635899560806
    ],
    "reason": "not distinguishable from the floor (at most -89.1 dB, floor -52.5 dB)"
   },
   {
    "order": 4,
    "offset_s": 0.10034333188799373,
    "level_db": null,
    "floor_db": -57.80719025423947,
    "band_hz": [
     319.24197039502076,
     8709.635899560806
    ],
    "reason": "not distinguishable from the floor (at most -99.8 dB, floor -57.8 dB)"
   },
   {
    "order": 5,
    "offset_s": 0.1164950007226698,
    "level_db": null,
    "floor_db": -63.44101796230984,
    "band_hz": [
     399.052462993776,
     8709.635899560806
    ],
    "reason": "not distinguishable from the floor (at most -100.3 dB, floor -63.4 dB)"
   }
  ],
  "aliased_distortion": [
   {
    "order": 2,
    "band_hz": [
     13161.456401756775,
     24000.0
    ],
    "level_db": null,
    "floor_db": null,
    "significant": false,
    "reason": "no wide enough part of the folded trajectory of harmonic 2 can be separated from the sweep and its non-aliased harmonics"
   },
   {
    "order": 3,
    "band_hz": [
     39.905246299377595,
     5173.605834496068
    ],
    "level_db": null,
    "floor_db": -1.4369206925915758,
    "significant": false,
    "reason": "not distinguishable from the floor (at most -32.3 dB, floor -1.4 dB)"
   }
  ],
  "loopback": null,
  "playback_speed": null,
  "notes": []
 },
 "decay": {
  "method": "ISO 3382-1 onset (-20 dB) per band; Schroeder backward integration with Lundeby noise truncation (plausibility-checked) and late-decay compensation; EDT/T20/T30 by least-squares fit per ISO 3382-1, fits starting after the direct sound; straightness check with xi and C (ISO 3382-2 Annex B); C50, C80, D50 and centre time from the same truncated energy; time-reversed Butterworth IEC 61260-1 base-10 octave-band filtering",
  "time_origin": "direct sound (time 0 = the detected broadband direct sound)",
  "broadband": {
   "band_label": "broadband",
   "center_hz": null,
   "mid_band_hz": null,
   "low_hz": null,
   "high_hz": null,
   "noise_floor_db": -61.94664551660378,
   "peak_to_noise_db": 61.94664551660378,
   "onset_time_s": -6.25e-05,
   "truncation_time_s": 0.1924375,
   "edt": {
    "name": "EDT",
    "seconds": 0.19414022084751986,
    "validity": "unreliable",
    "evaluation_range_db": [
     0.0,
     -10.0
    ],
    "nonlinearity_permille": 3.7772015560256778,
    "reason": "the decay curve drops 6.8 dB across the direct sound (it carries 79 % of the energy; limit 5 dB): EDT describes the direct sound rather than the room at this position"
   },
   "t20": {
    "name": "T20",
    "seconds": 0.19945616510468414,
    "validity": "valid",
    "evaluation_range_db": [
     -5.0,
     -25.0
    ],
    "nonlinearity_permille": 0.3637821247578499,
    "reason": null
   },
   "t30": {
    "name": "T30",
    "seconds": 0.19876802215811992,
    "validity": "valid",
    "evaluation_range_db": [
     -5.0,
     -35.0
    ],
    "nonlinearity_permille": 0.15297113146883756,
    "reason": null
   },
   "rt60_estimate_s": 0.19876802215811992,
   "rt60_basis": "T30",
   "curvature_percent": -0.34500961462036184,
   "filter_bt_product": null,
   "filter_warning": null,
   "warnings": [],
   "c50": {
    "name": "C50",
    "value": 21.708940280078863,
    "unit": "dB",
    "validity": "valid",
    "reason": null
   },
   "c80": {
    "name": "C80",
    "value": 30.60021788629028,
    "unit": "dB",
    "validity": "valid",
    "reason": null
   },
   "d50": {
    "name": "D50",
    "value": 99.32982895565817,
    "unit": "%",
    "validity": "valid",
    "reason": null
   },
   "centre_time": {
    "name": "Ts",
    "value": 0.0031804780120621022,
    "unit": "s",
    "validity": "valid",
    "reason": null
   }
  },
  "bands": [
   {
    "band_label": "63 Hz",
    "center_hz": 63.0,
    "mid_band_hz": 63.09573444801933,
    "low_hz": 44.66835921509631,
    "high_hz": 89.12509381337456,
    "noise_floor_db": -63.59762205879275,
    "peak_to_noise_db": 63.59762205879275,
    "onset_time_s": -0.04770833333333333,
    "truncation_time_s": 0.16260416666666666,
    "edt": {
     "name": "EDT",
     "seconds": null,
     "validity": "unreliable",
     "evaluation_range_db": [
      0.0,
      -10.0
     ],
     "nonlinearity_permille": null,
     "reason": "Evaluation range covers fewer than 3 samples after the direct sound; the decay curve drops 10.2 dB across the direct sound (it carries 91 % of the energy; limit 5 dB): EDT describes the direct sound rather than the room at this position"
    },
    "t20": {
     "name": "T20",
     "seconds": 0.17547462385115858,
     "validity": "valid",
     "evaluation_range_db": [
      -5.0,
      -25.0
     ],
     "nonlinearity_permille": 46.940216499675614,
     "reason": null
    },
    "t30": {
     "name": "T30",
     "seconds": 0.18139131309210219,
     "validity": "valid",
     "evaluation_range_db": [
      -5.0,
      -35.0
     ],
     "nonlinearity_permille": 30.384103744677038,
     "reason": null
    },
    "rt60_estimate_s": 0.18139131309210219,
    "rt60_basis": "T30",
    "curvature_percent": 3.371820443941953,
    "filter_bt_product": 8.064065464568783,
    "filter_warning": null,
    "warnings": [],
    "c50": {
     "name": "C50",
     "value": 25.337345181068386,
     "unit": "dB",
     "validity": "valid",
     "reason": null
    },
    "c80": {
     "name": "C80",
     "value": 40.79803866421801,
     "unit": "dB",
     "validity": "valid",
     "reason": null
    },
    "d50": {
     "name": "D50",
     "value": 99.70825957081976,
     "unit": "%",
     "validity": "valid",
     "reason": null
    },
    "centre_time": {
     "name": "Ts",
     "value": 0.001209046814962569,
     "unit": "s",
     "validity": "valid",
     "reason": null
    }
   },
   {
    "band_label": "125 Hz",
    "center_hz": 125.0,
    "mid_band_hz": 125.89254117941672,
    "low_hz": 89.12509381337455,
    "high_hz": 177.8279410038923,
    "noise_floor_db": -59.74010382287929,
    "peak_to_noise_db": 59.74010382287929,
    "onset_time_s": -0.023604166666666666,
    "truncation_time_s": 0.17775,
    "edt": {
     "name": "EDT",
     "seconds": null,
     "validity": "unreliable",
     "evaluation_range_db": [
      0.0,
      -10.0
     ],
     "nonlinearity_permille": null,
     "reason": "Evaluation range covers fewer than 3 samples after the direct sound; the decay curve drops 10.0 dB across the direct sound (it carries 90 % of the energy; limit 5 dB): EDT describes the direct sound rather than the room at this position"
    },
    "t20": {
     "name": "T20",
     "seconds": 0.1534789620406465,
     "validity": "valid",
     "evaluation_range_db": [
      -5.0,
      -25.0
     ],
     "nonlinearity_permille": 23.74126781782593,
     "reason": null
    },
    "t30": {
     "name": "T30",
     "seconds": 0.22095680893373765,
     "validity": "valid",
     "evaluation_range_db": [
      -5.0,
      -35.0
     ],
     "nonlinearity_permille": 62.788147177912926,
     "reason": null
    },
    "rt60_estimate_s": 0.22095680893373765,
    "rt60_basis": "T30",
    "curvature_percent": 43.96553507784389,
    "filter_bt_product": 19.59949805855376,
    "filter_warning": null,
    "warnings": [],
    "c50": {
     "name": "C50",
     "value": 25.893235478787812,
     "unit": "dB",
     "validity": "valid",
     "reason": null
    },
    "c80": {
     "name": "C80",
     "value": 34.857729064650826,
     "unit": "dB",
     "validity": "valid",
     "reason": null
    },
    "d50": {
     "name": "D50",
     "value": 99.74322080087003,
     "unit": "%",
     "validity": "valid",
     "reason": null
    },
    "centre_time": {
     "name": "Ts",
     "value": 0.0014446046498197325,
     "unit": "s",
     "validity": "valid",
     "reason": null
    }
   },
   {
    "band_label": "250 Hz",
    "center_hz": 250.0,
    "mid_band_hz": 251.188643150958,